{
  "schema_version": "tabletop_request.v1",
  "request_id": "tabletop-ab-20260902-move-worlds",
  "arm": "left",
  "input_status": {
    "geometry_status": "SIMULATION_ASSUMPTION",
    "blocking_assumptions": [
      "A1/B1 点位于瓶子中心偏右上，feature 到实际抓点的 T_object_grasp 尚未实测，当前临时使用单位变换",
      "当前瓶子尺寸临时沿用 70x70x200mm 仿真假设",
      "A3/B3 料框点临时解释为外形中心，内尺寸、底面和口沿高度尚未现场确认",
      "框内落点偏置沿用离线仿真候选值，尚未现场确认",
      "夹爪开口、闭合速度和力度为旧接口默认值，需现场调整确认"
    ]
  },
  "observation": {
    "observation_id": "A1-B1-shortest-arc-mean",
    "frame_id": "sdk_world",
    "length_unit": "millimeter",
    "quaternion_order": "xyzw",
    "pose_role": "OBJECT_POSE",
    "pose": {
      "position_mm": [952.7394104003906, 262.6982421875, 377.65773010253906],
      "quaternion_xyzw": [-0.011421248380830784, -0.6734216083547212, 0.010580952371455296, 0.7390946731869178]
    }
  },
  "object": {
    "object_id": "bottle-ab1",
    "class_id": "bottle-70x70x200-assumption",
    "dimensions_mm": [70.0, 70.0, 200.0],
    "dimensions_status": "SIMULATION_ASSUMPTION",
    "T_object_grasp": [
      [1.0, 0.0, 0.0, 0.0],
      [0.0, 1.0, 0.0, 0.0],
      [0.0, 0.0, 1.0, 0.0],
      [0.0, 0.0, 0.0, 1.0]
    ],
    "object_grasp_transform_status": "SIMULATION_ASSUMPTION",
    "orientation_policy": "FIXED_ENDPOINT_ORIENTATION",
    "fixed_endpoint_quaternion_xyzw": [-0.5829578492927693, 0.1267532371932152, 0.022018148116982255, 0.8022524315715647]
  },
  "transforms": {},
  "station": {
    "station_id": "material-box-a3b3",
    "table_surface_z_mm": 277.65773010253906,
    "table_surface_status": "SIMULATION_ASSUMPTION",
    "bin_rim_z_mm": 417.3118898152801,
    "bin_rim_status": "SIMULATION_ASSUMPTION",
    "material_box": {
      "frame_id": "sdk_world",
      "length_unit": "millimeter",
      "quaternion_order": "xyzw",
      "pose": {
        "position_mm": [1005.3442993164062, -32.95893096923828, 346.8427429199219],
        "quaternion_xyzw": [0.012198242102158101, -0.0024860017554143446, -0.013426551936668762, 0.9998323611425973]
      },
      "dimensions_mm": [310.0, 390.0, 130.0],
      "inner_dimensions_mm": [290.0, 370.0, 120.0],
      "geometry_status": "SIMULATION_ASSUMPTION",
      "datum_role": "ASSUMED_OUTER_GEOMETRY_CENTER",
      "T_box_place_grasp": [
        [1.0, 0.0, 0.0, -28.8069454386343],
        [0.0, 1.0, 0.0, 90.46674981972205],
        [0.0, 0.0, 1.0, 35.0],
        [0.0, 0.0, 0.0, 1.0]
      ],
      "placement_wall_margin_mm": 20.0
    },
    "safe_endpoint": {
      "frame_id": "sdk_world",
      "length_unit": "millimeter",
      "quaternion_order": "xyzw",
      "pose_role": "EE_POSE",
      "pose": {
        "position_mm": [692.441, 366.085, 443.775],
        "quaternion_xyzw": [-0.5829578492927693, 0.1267532371932152, 0.022018148116982255, 0.8022524315715647]
      }
    }
  },
  "motion_policy": {
    "minimum_lift_mm": 120.0,
    "pick_hover_offset_mm": 180.0,
    "place_hover_offset_mm": 180.0,
    "held_clearance_mm": 20.0
  },
  "gripper_policy": {
    "policy_id": "left-gripper2-site-tunable-v1",
    "gripper_id": 2,
    "tuning_status": "SITE_TUNABLE",
    "protocol_encoding": "EB90_UINT16_LITTLE_ENDIAN",
    "open_command": 17,
    "close_command": 16,
    "command_contract": "OPEN_POSITION_CLOSE_SPEED_FORCE",
    "value_unit": "device_native_uint16",
    "executor_binding": "execute_tabletop_pick_place_worlds.py/v1",
    "open": {"position": 500, "settle_s": 2.5},
    "close": {"speed": 500, "force": 1000, "settle_s": 5.0}
  }
}
